SteamAppid,Description,Type,Name,Publishers,Developers,isFree,InterfaceLanguages,FullAudioLanguages,SubtitlesLanguages,Windows,Mac,Linux,Date,ComingSoon,Currency,DiscountPercent,InitialFormatted,FinalFormatted
3130,"Men of War: Red Tide es la secuela del aclamado juego de estrategia en tiempo real Men of War. Red Tide introduce una campaña, impulsada por la historia, basada en los escritos del Soviético escribano Alexander Zorich, también incluye docenas de nuevas y mejoradas unidades y armas.",game,Men of War: Red Tide,Fulqrum Publishing,Fulqrum Publishing,false,"Inglés, Ruso, Alemán, Francés","Inglés, Ruso","Inglés, Ruso, Alemán, Francés",true,false,false,1 NOV 2009,false,ARS,0,ARS 400.00,"ARS$ 400,00"
3230,"Tres mil años en el futuro, la humanidad se ha labrado un sangriento camino hacia la dominación del universo conocido. Autoproclamada como una raza divina más allá del encasillamiento como un linaje más, ellos ven a las razas alienígenas como seres inferiores.",game,Genesis Rising,THQ Nordic,Metamorf,false,Inglés,No hay soporte para este tipo de idioma,Inglés,true,false,false,6 AGO 2007,false,ARS,0,ARS 82.00,"ARS$ 82,00"
3170,King's Bounty: Armored Princess es la secuela del aclamado título King's Bounty: The Legend.,game,King's Bounty: Armored Princess,Fulqrum Publishing,Katauri Interactive,false,"Inglés, Ruso, Francés, Alemán, Español de España, Italiano, Japonés, Chino tradicional",No hay soporte para este tipo de idioma,"Inglés, Ruso, Francés, Alemán, Español de España, Italiano, Japonés, Chino tradicional",true,true,false,19 NOV 2009,false,ARS,0,ARS 765.00,"ARS$ 765,00"
3330,"Deep in the jungle lie hidden temples bursting with traps and trickery, and it's up to you to uncover their treasures. Fire magical balls from your stone frog idol to make matches of three or more and clear the deadly chain before it reaches the golden skull.",game,Zuma Deluxe,"PopCap Games, Inc., Electronic Arts","PopCap Games, Inc.",false,"Inglés, Francés, Alemán, Italiano, Español de España",No hay soporte para este tipo de idioma,"Inglés, Francés, Alemán, Italiano, Español de España",true,true,false,30 AGO 2006,false,ARS,0,ARS 67.99,"ARS$ 67,99"
3310,"Drag the rows of fuzzy Chuzzles up and down, left and right, to match colors, and they'll pop and return to their test-tube home. Choose from four play modes and two difficulty levels.",game,Chuzzle Deluxe,"PopCap Games, Inc., Electronic Arts","PopCap Games, Inc.",false,"Inglés, Francés, Alemán, Italiano, Español de España",No hay soporte para este tipo de idioma,"Inglés, Francés, Alemán, Italiano, Español de España",true,true,false,30 AGO 2006,false,ARS,0,ARS 67.99,"ARS$ 67,99"
3360,"Here's your chance to strike it rich! Grab as much loot as you can before your pile of coins reaches the top of the window. If you move fast enough to fill the money meter, you'll score a moneybag. Collect enough bags, and you'll join the ranks of the rich and famous.",game,Big Money! Deluxe,"PopCap Games, Inc.","PopCap Games, Inc.",false,Inglés,No hay soporte para este tipo de idioma,Inglés,true,false,false,30 AGO 2006,false,ARS,0,ARS 67.99,"ARS$ 67,99"
3320,"The craziest aquarium game ever! Tend to your fish, keep them happy and they'll reward you with coins and jewels. Buy tank upgrades or egg parts which hatch different in-tank pets. These pets can help you feed your fish, collect coins, or even protect against the aliens that will invade your tank.",game,Insaniquarium Deluxe,"PopCap Games, Inc., Electronic Arts","PopCap Games, Inc.",false,Inglés,No hay soporte para este tipo de idioma,Inglés,true,false,false,30 AGO 2006,false,ARS,0,ARS 67.99,"ARS$ 67,99"
3270,"¡La muy aclamada y galardonada saga FPS ha vuelto! ¡Cargado con toneladas de frenética acción y adrenalina en sus misiones para un solo jugador y multijugador, Painkiller Overdose nos ofrece 6 innovadoras armas demoníacas, una física alucinante, mapas de iluminación en los jugadores, más de 40 monstruos dementes traídos del Infierno y...",game,Painkiller Overdose,Prime Matter,Mindware Studios,false,"Inglés, Alemán",No hay soporte para este tipo de idioma,"Inglés, Alemán",true,false,false,30 OCT 2007,false,ARS,0,ARS 67.99,"ARS$ 67,99"
7010,"Experimenta la tensión dramática de hallarte en el frente de una guerra a través de los ojos de una nueva raza de supersoldados en este crudo y épico juego de acción en primera persona.Un supersoldado mejorado tiene que detener a un régimen de renegados que pretende acabar con el mundo civilizado.Hong Kong, año 2065.",game,Project: Snowblind,Square Enix,Crystal Dynamics,false,Inglés,No hay soporte para este tipo de idioma,Inglés,true,false,false,29 MAR 2007,false,ARS,0,ARS 78.99,"ARS$ 78,99"
6920,"Aproximadamente 20 años después de los hechos acontecidos en Deus Ex, el mundo apenas ha empezado a recuperarse de una depresión catastrófica. En el caótico periodo de recuperación, varias religiones y facciones políticas han visto una oportunidad para remodelar un gobierno mundial que los beneficie, sabiendo que los movimientos...",game,Deus Ex: Invisible War,Eidos Interactive Corp.,Ion Storm,false,Inglés,No hay soporte para este tipo de idioma,Inglés,true,false,false,29 MAR 2007,false,ARS,0,ARS 419.00,"ARS$ 419,00"
6910,"The year is 2052 and the world is a dangerous and chaotic place. Terrorists operate openly - killing thousands; drugs, disease and pollution kill even more. The world's economies are close to collapse and the gap between the insanely wealthy and the desperately poor grows ever wider.",game,Deus Ex: Game of the Year Edition,Eidos Interactive Corp.,Ion Storm,false,Inglés,No hay soporte para este tipo de idioma,Inglés,true,false,false,29 MAR 2007,false,ARS,0,ARS 419.00,"ARS$ 419,00"
7200,TrackMania es el juego de carreras de coches más entretenido de la historia. Millones de personas lo juegan en los modos individual o multijugador. TrackMania United Forever es la edición definitiva de TrackMania gracias a las numerosas innovaciones y extras que ofrece.,game,Trackmania United Forever,Ubisoft,Nadeo,false,"Inglés, Francés, Alemán, Italiano, Español de España, Portugués de Portugal, Japonés, Chino tradicional, Coreano, #lang_slovakian, Holandés, Ruso, Húngaro, Checo, Polaco",No hay soporte para este tipo de idioma,"Inglés, Francés, Alemán, Italiano, Español de España, Portugués de Portugal, Japonés, Chino tradicional, Coreano, #lang_slovakian, Holandés, Ruso, Húngaro, Checo, Polaco",true,false,false,16 ABR 2008,false,ARS,0,ARS 2999.00,"ARS$ 2.999,00"
6980,"Eres Garrett, el maestro ladrón. Pocas veces visto y nunca atrapado, Garret está mejor que nunca. Es capaz de despistar a cualquier guardia, de abrir cualquier cerradura y de entrar en las residencias con los sistemas de seguridad más ingeniosos.",game,Thief: Deadly Shadows,Eidos Interactive Corp.,Ion Storm,false,Inglés,No hay soporte para este tipo de idioma,Inglés,true,false,false,29 MAR 2007,false,ARS,0,ARS 539.00,"ARS$ 539,00"
7110,Step into the role of an aspiring martial-arts master and follow the path of the open palm or the closed fist.,game,Jade Empire™: Special Edition,"BioWare, Electronic Arts",BioWare,false,"Inglés, Francés, Alemán, Italiano, Español de España",No hay soporte para este tipo de idioma,"Inglés, Francés, Alemán, Italiano, Español de España",true,false,false,27 FEB 2007,false,ARS,0,ARS 699.00,"ARS$ 699,00"
7000,"Sigue a Lara Croft en una aventura en la que recorre el mundo viajando a lugares exóticos en busca de uno de los artefactos más importantes de la historia, algo que resucitará a ciertos personajes indeseables del misterioso pasado de Lara.",game,Tomb Raider: Legend,Crystal Dynamics,Crystal Dynamics,false,"Inglés, Francés, Italiano, Alemán, Español de España",No hay soporte para este tipo de idioma,"Inglés, Francés, Italiano, Alemán, Español de España",true,false,false,29 MAR 2007,false,ARS,0,ARS 419.00,"ARS$ 419,00"
7020,"Nu Earth: a poisoned planet where endless war rages between the Norts and the Southers. A futile struggle on a hostile planet with no end in sight. But there are tales of a lone warrior. A man who knows no allegiance, the Rogue Trooper!",game,Rogue Trooper,Rebellion,Rebellion,false,"Inglés, Francés, Alemán, Italiano, Español de España",No hay soporte para este tipo de idioma,"Inglés, Francés, Alemán, Italiano, Español de España",true,false,false,29 MAR 2007,false,ARS,0,ARS 129.99,"ARS$ 129,99"
7210,"Nueva York, año 2000......Sin saber cómo o por qué, Brian, un estudiante a punto de graduarse en la Universidad, es atacado por gángsters de la Mafia.Durante su desesperada huida, en compañía de una misteriosa bailarina de striptease, acaba conociendo a un grupo de personajes poco usuales.",game,"Runaway, A Road Adventure",Focus Entertainment,Pendulo Studios,false,"Inglés, Francés<strong>*</strong>",Inglés,"Inglés, Francés<strong>*</strong>",true,false,false,14 MAR 2007,false,ARS,0,ARS 269.90,"ARS$ 269,90"
7220,"Viaja a los cuatro rincones del mundo con Brian y Gina en una loca historia llena de sorpresas. Piratas, espías, surfistas, soldados e incluso alienígenas; todos están en el ajo - ¡Y su combinación crea una experiencia maravillosa para saborear y recordar para siempre!",game,"Runaway, The Dream of The Turtle",Focus Entertainment,Pendulo Studios,false,"Inglés, Francés",No hay soporte para este tipo de idioma,"Inglés, Francés",true,false,false,14 MAR 2007,false,ARS,0,ARS 269.90,"ARS$ 269,90"
7340,"Atrapado en un libro mágico de puzles, el aventurero Titus necesita tu ayuda para librarse del hechizo. Para llevar a cabo esta tarea, deberás resolver los peliagudos puzles de Azada™. Descifra las series de puzles y completa las páginas perdidas del libro encantado para liberar a Titus de su prisión.",game,Azada,Big Fish Games,Big Fish Games,false,Inglés,No hay soporte para este tipo de idioma,Inglés,true,false,false,21 ABR 2010,false,ARS,0,ARS 129.99,"ARS$ 129,99"
7510,"En X-Blades, el jugador encarna a la encantadora heroína Ayumi, una superviviente de los terribles ataques de las Hordas de la Oscuridad. Esta bella anime de larga melena, armada con sus espadas-pistola y sus asombrosos saltos, pasa, de voltereta en voltereta, de un fantástico nivel al siguiente.",game,X-Blades,Topware Interactive,Gaijin Entertainment,false,"Inglés, Francés, Alemán, Italiano, Español de España",No hay soporte para este tipo de idioma,"Inglés, Francés, Alemán, Italiano, Español de España",true,true,true,30 ABR 2009,false,ARS,0,ARS 129.99,"ARS$ 129,99"
7600,Sid Meier's Railroads! marca el regreso del momento clave en la simulación y estrategia que empezó la popular moda &quot;tycoon&quot; e inspiró toda una nueva generación de juegos. ¡Sid Meier's Railroads!,game,Sid Meier's Railroads!,"2K, Feral Interactive (Mac)","Firaxis Games, Feral Interactive (Mac)",false,"Inglés, Francés, Alemán, Italiano, Español de España",No hay soporte para este tipo de idioma,"Inglés, Francés, Alemán, Italiano, Español de España",true,true,false,4 MAY 2007,false,ARS,0,ARS 179.99,"ARS$ 179,99"
7520,"Echa un vistazo al nuevo pack Velvet Edition, el cual incluye Two Worlds II y el DLC Pirates of the Flying Fortress.",game,Two Worlds II HD,"Topware Interactive, ACE",Reality Pump Studios,false,"Inglés, Francés, Alemán, Italiano, Español de España, Checo, Polaco, Ruso","Inglés, Alemán","Inglés, Francés, Alemán, Italiano, Español de España, Checo, Polaco, Ruso",true,true,false,3 FEB 2011,false,ARS,0,ARS 224.99,"ARS$ 224,99"
7530,"Mientras la sangrienta batalla entre las tropas de Gandohar y los ejércitos de orcos se libra a las puertas de Vahkmaar, el emperador espera en las profundidades del palacio el resultado de esta lucha por el poder.",game,Two Worlds II Castle Defense,Topware Interactive,Reality Pump Studios,false,"Inglés, Francés, Alemán, Italiano, Ruso, Español de España",Inglés,"Inglés, Francés, Alemán, Italiano, Ruso, Español de España",true,true,false,14 JUN 2011,false,ARS,0,ARS 129.99,"ARS$ 129,99"
7260,"Un viaje de fantasía a través de las grandes mitologías. Loki permite que el jugador se meta en el papel de uno de los cuatro héroes del juego, cada uno extraído de una mitología diferente: un fuerte luchador nórdico, un fiero guerrero griego, un poderoso mago egipcio o un chamán azteca que domina los secretos del mundo de los espíritus.",game,Loki,,Cyanide Studios,false,Inglés,No hay soporte para este tipo de idioma,Inglés,true,false,false,5 NOV 2007,false,ARS,0,ARS 139.99,"ARS$ 139,99"
7670,"BioShock es un shooter distinto a todos los que has jugado antes, lleno de armas y tácticas nunca vistas. Tendrás un completo arsenal a tu disposición: desde sencillos revólveres a lanzagranadas y lanzadores de productos químicos, pero también estarás obligado a modificar tu ADN para crear un arma mucho más mortífera: tú.",game,BioShock™,2K,"2K Boston, 2K Australia",false,"Inglés, Francés, Alemán, Italiano, Español de España<strong>*</strong>","Inglés, Francés, Alemán, Italiano","Inglés, Francés, Alemán, Italiano, Español de España<strong>*</strong>",true,false,false,21 AGO 2007,false,,0,ARS 0.00,
7660,"Algo malvado deambula esta noche por la ciudad... La Tierra ha sido devastada por los excesos humanos, los conflictos menores y la invasión alienígena. La población mundial se ha concentrado en enormes ciudades, la primera de las cuales fue Mega Primus.",game,X-COM: Apocalypse,2K,"MicroProse Software, Inc",false,Inglés,No hay soporte para este tipo de idioma,Inglés,true,false,false,4 SEP 2008,false,ARS,0,ARS 89.99,"ARS$ 89,99"
7650,"The war continues... X-COM: UFO Defense brought you to a galactic battlefield. X-COM: Terror from the Deep brings the alien terror into a totally new dimension.Seeking to take advantage of a weakened Earth, X-COM's deep space foes unexpectedly change strategy and launch a powerful second front against planet Earth.",game,X-COM: Terror From the Deep,2K,"MicroProse Software, Inc",false,"Inglés, Francés, Alemán, Español de España",No hay soporte para este tipo de idioma,"Inglés, Francés, Alemán, Español de España",true,false,false,4 MAY 2007,false,ARS,0,ARS 89.99,"ARS$ 89,99"
7760,You are in control of X-COM: an organization formed by the world's governments to fight the ever-increasing alien menace.,game,X-COM: UFO Defense,2K,"MicroProse Software, Inc",false,Inglés,No hay soporte para este tipo de idioma,Inglés,true,false,false,4 SEP 2008,false,ARS,0,ARS 89.99,"ARS$ 89,99"
7730,"Han vuelto... solo que esta vez los atroces alienígenas intentan acabar con la Tierra y hacerse con el control de la nueva frontera. Como comandante de X-COM, tu único deber es proteger a la humanidad y las preciadas operaciones de minería que se realizan en el espacio exterior.",game,X-COM: Interceptor,2K,"MicroProse Software, Inc",false,Inglés,No hay soporte para este tipo de idioma,Inglés,true,false,false,4 SEP 2008,false,ARS,0,ARS 89.99,"ARS$ 89,99"
7830,"Men of War es un increíble juego de Estrategia en Tiempo Real que se desarrolla durante el apogeo de la Segunda Guerra Mundial. Intensas batallas ocurren en Europa y el Norte de África mientras los jugadores toman el papel de los Soviéticos, Aliados o fuerzas Alemanas a través de 19 masivas misiones de un jugador.",game,Men of War™,Fulqrum Publishing,"Best Way, Digitalmindsoft",false,"Inglés, Ruso, Francés, Italiano, Español de España, Alemán<strong>*</strong>","Inglés, Ruso, Francés, Italiano, Español de España","Inglés, Ruso, Francés, Italiano, Español de España, Alemán<strong>*</strong>",true,false,false,6 MAY 2009,false,ARS,0,ARS 400.00,"ARS$ 400,00"
7860,"La Guerra es el Infierno NecroVision es un shooter en primera persona que lleva a los jugadores a los frenéticos campos de batalla de la Primera Guerra Mundial y a un oscuro submundo de vampiros, demonios y magia negra.",game,NecroVision,Fulqrum Publishing,The Farm 51,false,"Inglés, Francés, Alemán, Español de España, Italiano, Ruso, Húngaro, Checo, Polaco<strong>*</strong>","Inglés, Francés, Alemán, Español de España, Italiano, Ruso","Inglés, Francés, Alemán, Español de España, Italiano, Ruso, Húngaro, Checo, Polaco<strong>*</strong>",true,false,false,20 MAY 2009,false,ARS,0,ARS 400.00,"ARS$ 400,00"
7800,"Conviértete en zombi, reparte tripas ¡y come cerebros!",game,Stubbs the Zombie in Rebel Without a Pulse,Aspyr,Aspyr,false,"Inglés, Francés, Alemán, Español de España, Ruso, Chino simplificado",No hay soporte para este tipo de idioma,"Inglés, Francés, Alemán, Español de España, Ruso, Chino simplificado",true,false,false,16 MAR 2021,false,ARS,0,ARS 1400.00,"ARS$ 1.400,00"
7770,"X-COM: Unidad terrícola eXtraterrestre de COMbate ultrasecreta El lugar: América, principios del siglo XXI La misión: Erradicar los extraterrestres Las fuerzas alienígenas han invadido la Tierra y están aterrorizando a la población.",game,X-COM: Enforcer,2K,"MicroProse Software, Inc",false,Inglés,No hay soporte para este tipo de idioma,Inglés,true,false,false,4 SEP 2008,false,ARS,0,ARS 89.99,"ARS$ 89,99"
7840,"¿Tienes lo que hay que tener para Sobrevivir? Death Track: Resurrection es un juego de carreras y acción que sitúa a los jugadores en un futuro post-apocalíptico y no tan lejano, donde los deportes tradicionales han sido sustituidos por un entretenimiento bastante más violento.",game,Death Track®: Resurrection,Fulqrum Publishing,Sky Fallen,false,"Inglés, Alemán, Francés, Español de España, Italiano",No hay soporte para este tipo de idioma,"Inglés, Alemán, Francés, Español de España, Italiano",true,false,false,6 MAY 2009,false,ARS,0,ARS 249.00,"ARS$ 249,00"
8000,"Tomb Raider: Anniversary regresa al instante donde la aventura original de Lara Croft, en su búsqueda del legendario artefacto Scion, definió el género en tercera persona. Usando un mejorado motor de Tomb Raider: Legend, los gráficos, la tecnología y la física llevan la aventura de Lara y la búsqueda de un místico artefacto únicamente...",game,Tomb Raider: Anniversary,Crystal Dynamics,Crystal Dynamics,false,"Inglés, Francés, Alemán, Italiano, Español de España",No hay soporte para este tipo de idioma,"Inglés, Francés, Alemán, Italiano, Español de España",true,false,false,5 JUN 2007,false,ARS,0,ARS 539.00,"ARS$ 539,00"
7940,"El nuevo thriller de acción del galardonado equipo de Infinity Ward, los creadores de la serie Call of Duty®, ofrece la experiencia cinematográfica más intensa jamás vista hasta la fecha. Call of Duty 4: Modern Warfare equipa a los jugadores con un avanzado y moderno arsenal de alta potencia de fuego y los transporta a los lugares más...",game,Call of Duty® 4: Modern Warfare® (2007),Activision,Infinity Ward,false,"Inglés, Francés, Alemán, Italiano, Español de España",No hay soporte para este tipo de idioma,"Inglés, Francés, Alemán, Italiano, Español de España",true,true,false,12 NOV 2007,false,ARS,0,ARS 346.83,"ARS$ 346,83"
8140,"Tomb Raider: Underworld representa una nueva evolución en la jugabilidad basada en la exploración. En el papel de la valiente aventurera Lara Croft, explora exóticos lugares por todo el mundo, cada uno de ellos diseñado con un increíble cuidado por los detalles que da como resultado una sorprendente fidelidad visual en alta definición...",game,Tomb Raider: Underworld,Crystal Dynamics,Crystal Dynamics,false,"Inglés, Francés, Italiano, Alemán, Español de España",No hay soporte para este tipo de idioma,"Inglés, Francés, Italiano, Alemán, Español de España",true,false,false,21 NOV 2008,false,ARS,0,ARS 539.00,"ARS$ 539,00"
8080,"Kane and Lynch: Dead Men es la nueva saga de acción creada por Io-Interactive, el padre de la serie Hitman que ha vendido millones de copias. Kane &amp; Lynch: Dead Men sigue el violento y caótico viaje de dos hombres, un mercenario curtido y un psicópata medicado, en su actitud brutal hacia lo correcto y lo incorrecto.",game,Kane and Lynch: Dead Men™,Square Enix,IO Interactive,false,"Inglés, Francés, Alemán, Italiano, Español de España<strong>*</strong>","Francés, Alemán, Italiano","Inglés, Francés, Alemán, Italiano, Español de España<strong>*</strong>",true,false,false,13 DIC 2007,false,,0,ARS 0.00,
8100,*Este título solo es para un jugador*Venezuela se encuentra en un estado de guerra civil después de que el gobierno haya sido derrocado brutalmente mediante un golpe de estado. La amenaza debe ser neutralizada y los Estados Unidos no pueden arriesgarse a sufrir una guerra nuclear.,game,Conflict: Denied Ops,Square Enix,Pivotal Games,false,"Inglés, Español de España, Francés, Italiano",No hay soporte para este tipo de idioma,"Inglés, Español de España, Francés, Italiano",true,false,false,8 FEB 2008,false,ARS,0,ARS 78.99,"ARS$ 78,99"
8320,¡Ha llegado el tiempo de la feria de primavera y La Gran Carrera de Vacas está a punto de comenzar! Juega a juegos de feria. Escribe poesía de amor. Sé más listo que una abeja realmente grande. Consigue los huevos que tan duramente se han ganado los vecinos locales a base de engaños. Golpea algunas ollas y sartenes.,game,Bone: The Great Cow Race,Telltale Games,Telltale Games,false,Inglés,No hay soporte para este tipo de idioma,Inglés,true,false,false,17 JUN 2008,false,,0,ARS 0.00,
8190,"Sumérgete en una aventura frenética con total libertad, con más de 400 millas cuadradas de terreno escabroso y centenares de armas y vehículos,",game,Just Cause 2,Square Enix,Avalanche Studios,false,"Inglés, Francés, Alemán, Italiano, Español de España, Polaco, Ruso","Inglés, Francés, Alemán, Italiano, Español de España","Inglés, Francés, Alemán, Italiano, Español de España, Polaco, Ruso",true,false,false,23 MAR 2010,false,ARS,0,ARS 179.99,"ARS$ 179,99"
8170,Vive la guerra a través de dos sagas épicas en las que formarás parte de la historia o la cambiarás. Siente la fuerza de las históricas y decisivas batallas de la guerra del Pacífico. Revive por primera vez algunas de las batallas navales más espectaculares e importantes de la historia reciente y dirige a tu flota para que la guerra...,game,Battlestations Pacific,Square Enix,Eidos Studio Hungary,false,"Inglés, Francés, Alemán, Italiano, Español de España",No hay soporte para este tipo de idioma,"Inglés, Francés, Alemán, Italiano, Español de España",true,false,false,12 MAY 2009,false,,0,ARS 0.00,
8330,"Join poker's most outspoken players for a hand of Telltale Texas Hold'em, the card game stacked high with personality. Quips will fly, chips will fall, and you may just end up rolling in the aisles.This is your chance to play in a poker tournament against four characters of such lethal absurdity, you'll either die laughing or die trying.",game,Telltale Texas Hold ‘Em,Telltale,Telltale,false,Inglés,No hay soporte para este tipo de idioma,Inglés,true,false,false,17 JUN 2008,false,ARS,0,ARS 82.00,"ARS$ 82,00"
8400,"Geometry Wars: Retro Evolved es un juego de disparos a la vieja usanza, pero rediseñado para el siglo XXI mediante gráficos de nueva generación y una profunda y moderna mecánica de juego. Ésta es muy simple: eres una &quot;nave&quot; geométrica atrapada en un mundo cuadriculado donde te enfrentas a oleadas de molinillos púrpura mortales,...",game,Geometry Wars: Retro Evolved,Activision,Bizarre Creations,false,Inglés,No hay soporte para este tipo de idioma,Inglés,true,false,false,18 JUN 2007,false,ARS,0,ARS 69.23,"ARS$ 69,23"
8310,"Tras el ataque de una nube de langostas, Fone Bone está perdido en las montañas. Emprende entonces la búsqueda de sus primos, recibiendo un poco de ayuda de un misterioso dragón rojo, un par de bichos parlantes y una bonita chica llamada Thorn.",game,Bone: Out From Boneville,Telltale Games,Telltale Games,false,Inglés,No hay soporte para este tipo de idioma,Inglés,true,false,false,17 JUN 2008,false,,0,ARS 0.00,
8500,"EVE Online es un juego donde la historia la escriben los jugadores, en un universo de una belleza, profundidad y oportunidades sin parangón. Únete con tu nave y embárcate en una aventura de industria, exploración y conquista mientras grabas tu nombre en la historia de New Eden.",game,EVE Online,CCP,CCP,true,"Inglés, Alemán, Ruso, Francés, Coreano, Japonés, Español de España","Inglés, Alemán, Ruso, Francés, Coreano, Japonés","Inglés, Alemán, Ruso, Francés, Coreano, Japonés, Español de España",true,true,false,15 DIC 2010,false,,0,ARS 0.00,
8600,"ActualizaciónSimBin Studios amplía el exitoso juego de carreras RACE 07 con el add-on Andy Priaulx Crowne Plaza Raceway. Este add-on, gratuito para todos los poseedores de RACE 07, presenta un flamante circuito y nuevos coches, incluyendo al tres veces campeón del mundo Andy Priaulx, con su BMW 320si WTCC, y a Fabrizio Giovanardi, con su...",game,RACE 07,SimBin,SimBin,false,"Inglés, Francés, Alemán, Italiano, Español de España",No hay soporte para este tipo de idioma,"Inglés, Francés, Alemán, Italiano, Español de España",true,false,false,15 OCT 2007,false,ARS,0,ARS 53.99,"ARS$ 53,99"
8660,"49 unique cars in 12 classes – over 500 combinations.The most beautiful GT’s. Extreme versions of the already spectacular World Touring Cars. Exclusive road cars from prestigious brands.You will find that and much more in GTR Evolution, including the legendary Nürburgring Nordschleife, the fabled 22,8km long racetrack in Germany.",dlc,GTR Evolution Expansion Pack for RACE 07,SimBin,SimBin,false,"Inglés, Francés, Alemán, Italiano, Español de España",No hay soporte para este tipo de idioma,"Inglés, Francés, Alemán, Italiano, Español de España",true,false,false,1 SEP 2008,false,ARS,0,ARS 439.99,"ARS$ 439,99"
