SteamAppid,Description,Type,Name,Publishers,Developers,isFree,InterfaceLanguages,FullAudioLanguages,SubtitlesLanguages,Windows,Mac,Linux,Date,ComingSoon,Currency,DiscountPercent,InitialFormatted,FinalFormatted
55390,Tantos trucos que no sabrás que hacer con ellos. ¡No te vuelvas a preocupar de morir o quedarte sin munición! Desbloquea el truco Baja de Ahí que te hará ultraflexible. Supersaints te proporciona mejores armas y salud mientras que Cargador Definitivo asegura que siempre estés listo para disparar.,dlc,Saints Row: The Third Invincible Pack,Deep Silver,Volition,false,"Checo, Holandés, Inglés, Francés, Alemán, Italiano, Polaco, Ruso, Español de España",No hay soporte para este tipo de idioma,"Checo, Holandés, Inglés, Francés, Alemán, Italiano, Polaco, Ruso, Español de España",true,false,true,17 NOV 2011,false,ARS,0,ARS 39.99,"ARS$ 0,00"
55398,"Una colección de vehículos militares completamente equipados para tu garaje. El VTOL de los Saints incluye modos a reacción y suspensión, haciendo que los ataques aéreos sean fáciles y con estilo. El Tanque de los Saints y el N-Forcer de los Saints son lo último en blindados y enseñará a tus oponentes que a los Saints no hay que tocarles...",dlc,Saints Row: The Third - Special Ops Vehicle Pack,Deep Silver,Volition,false,"Checo, Holandés, Inglés, Francés, Alemán, Italiano, Polaco, Ruso, Español de España",No hay soporte para este tipo de idioma,"Checo, Holandés, Inglés, Francés, Alemán, Italiano, Polaco, Ruso, Español de España",true,false,true,10 ABR 2012,false,ARS,0,ARS 39.99,"ARS$ 0,00"
55395,El Warrior Pack añade a tu armario cuatro vestimentas listas para el combate. Las antigüedades nunca pasan de moda con la Armadura de Caballero de Steelport. O vete a por algo un poco más atrevido con el conjunto de Princesa Guerrera.,dlc,Saints Row: The Third Warrior Pack,Deep Silver,Volition,false,"Checo, Holandés, Inglés, Francés, Alemán, Italiano, Polaco, Ruso, Español de España",No hay soporte para este tipo de idioma,"Checo, Holandés, Inglés, Francés, Alemán, Italiano, Polaco, Ruso, Español de España",true,false,true,20 DIC 2011,false,ARS,0,ARS 39.99,"ARS$ 0,00"
56431,Incluye 4 habilidades únicas y objetos de combate para equipar a tu escuadrón.ROMPECRÁNEOS: Golpea a tu enemigo con esta arma para tener la posibilidad de provocar un ataque con área de efecto explosivaARMADURA DEL INMORTAL: Obtén la protección de un escudo de invulnerabilidad cuando tu personaje sufra una herida críticaHERALDO DE...,dlc,"Warhammer 40,000: Dawn of War II - Retribution Chaos Space Marines Race Pack","SEGA, Feral interactive (Mac/Linux)","Relic Entertainment, Feral interactive (Mac/Linux)",false,"Inglés, Francés, Alemán, Italiano",No hay soporte para este tipo de idioma,"Inglés, Francés, Alemán, Italiano",true,true,true,3 MAR 2011,false,ARS,0,ARS 13.99,"ARS$ 0,00"
56400,"Lidera cualquiera de las seis facciones únicas en la siguiente expansión independiente de Dawn of War, la aclamada franquicia de estrategia en tiempo real. Elige construir un nuevo y gigantesco ejército o lidera una pequeña escuadra de héroes de élite en la batalla y experimenta una campaña para Un jugador personalizada con tu raza...",game,"Warhammer 40,000: Dawn of War II: Retribution","SEGA, Feral Interactive (Mac/Linux)","Relic Entertainment, Feral Interactive (Mac/Linux)",false,"Inglés, Francés, Alemán, Italiano, Checo, Polaco, Ruso, Chino tradicional",Inglés,"Inglés, Francés, Alemán, Italiano, Checo, Polaco, Ruso, Chino tradicional",true,true,true,3 MAR 2011,false,ARS,0,ARS 329.99,"ARS$ 329,99"
55399,Conviértete en una pesadilla pavorosa con estos terroríficos conjuntos. El conjunto de zombi comecarne pondrá en fuga a todos tus conocidos. Aún más horripilante es el conjunto de apuñalador: todos tus peores sueños reunidos en uno. Y ningún pack de terror estaría completo sin un conjunto de hombre lobo que te hará aullar a la luna.,dlc,Saints Row: The Third - Horror Pack,Deep Silver,Volition,false,"Checo, Holandés, Inglés, Francés, Alemán, Italiano, Polaco, Ruso, Español de España",No hay soporte para este tipo de idioma,"Checo, Holandés, Inglés, Francés, Alemán, Italiano, Polaco, Ruso, Español de España",true,false,true,7 AGO 2012,false,ARS,0,ARS 39.99,"ARS$ 0,00"
55396,¡La colección definitiva de objetos para los fans de Nyte Blayde! Viste como una estrella de Nyte Blayde con réplicas exactas de los atuendos del Monaguillo y Canonesa Sangrienta. Experimenta la emoción de las aventuras de Nyte Blayde poniéndote al volante del vehículo Nyte Blayde Móvil.,dlc,Saints Row: The Third - Nyte Blayde Pack,Deep Silver,Volition,false,"Checo, Holandés, Inglés, Francés, Alemán, Italiano, Polaco, Ruso, Español de España",No hay soporte para este tipo de idioma,"Checo, Holandés, Inglés, Francés, Alemán, Italiano, Polaco, Ruso, Español de España",true,false,true,10 ABR 2012,false,ARS,0,ARS 39.99,"ARS$ 0,00"
55400,"Conduce al estilo Genki Girl con este surtido de vehículos. Sad Panda tiene un buggy, Angry Tiger su motocicleta y Sexy Kitten conduce un deportivo muy especial. ¡Cada vehículo está decorado al estilo de las chicas y contiene una mortífera sorpresa!",dlc,Saints Row: The Third - Genki Girl Pack,Deep Silver,Volition,false,"Checo, Holandés, Inglés, Francés, Alemán, Italiano, Polaco, Ruso, Español de España",No hay soporte para este tipo de idioma,"Checo, Holandés, Inglés, Francés, Alemán, Italiano, Polaco, Ruso, Español de España",true,false,true,3 JUL 2012,false,ARS,0,ARS 39.99,"ARS$ 0,00"
55397,Dale a tu guardarropa un toque pandillero con seis conjuntos nuevos. Disfrázate de soldado de los Morningstar o mézclate con la multitud como especialista de los Luchadores. ¡Hasta puedes probar el estilo ciberpunk de Decker y ponerte en contacto con tu tecnogótico interior!,dlc,Saints Row: The Third - Steelport Gangs Pack,Deep Silver,Volition,false,"Checo, Holandés, Inglés, Francés, Alemán, Italiano, Polaco, Ruso, Español de España",No hay soporte para este tipo de idioma,"Checo, Holandés, Inglés, Francés, Alemán, Italiano, Polaco, Ruso, Español de España",true,false,true,1 MAY 2012,false,ARS,0,ARS 39.99,"ARS$ 0,00"
56436,"Incluye 4 habilidades únicas y objetos de combate para equipar a tu escuadrón.GARRAS VENENOSAS: Los ataques contra el enemigo tienen una probabilidad garantizada de aturdir y envenenar durante un corto periodo de tiempoQUISTES VENENOSOS: Tras recibir una cantidad determinada de daño cuerpo a cuerpo, el Señor del Enjambre emite una nube...",dlc,"Warhammer 40,000: Dawn of War II - Retribution - Tyranid Race Pack","SEGA, Feral Interactive (Mac/Linux)","Relic Entertainment, Feral Interactive (Mac/Linux)",false,,No hay soporte para este tipo de idioma,,true,true,true,3 MAR 2009,false,ARS,0,ARS 13.99,"ARS$ 0,00"
56432,Incluye 4 habilidades únicas y objetos de combate para equipar a tu escuadrón.LANZA DE YNNEAD: Los ataques que reciban los enemigos pueden causarles confusión y hacer que se ataquen los unos a los otros ASTUCIA DE CEGORACH: La muerte de unidades aliadas aumenta la probabilidad de que entres en un estado de furia que aumente tu velocidad...,dlc,"Warhammer 40,000: Dawn of War II - Retribution Eldar Race Pack","SEGA, Feral interactive (Mac/Linux)","Relic Entertainment, Feral interactive (Mac/Linux)",false,"Inglés, Francés, Alemán, Italiano",No hay soporte para este tipo de idioma,"Inglés, Francés, Alemán, Italiano",true,true,true,3 MAR 2011,false,ARS,0,ARS 13.99,"ARS$ 0,00"
56435,"Incluye 4 habilidades únicas y objetos de combate para equipar a tu escuadrón.KAN OPENER: Tus ataques tienen la posibilidad de desactivar los vehículos enemigosANGRY ARMOR: Los ataques enemigos al Kaudillo aumentan el daño que éste haceLUCKY TEEF: Cuando el Kaudillo acaba con un enemigo, las unidades aliadas cercanas consiguen...",dlc,"Warhammer 40,000: Dawn of War II - Retribution Ork Race Pack","SEGA, Feral Interactive (Mac/Linux)","Relic Entertainment, Feral Interactive (Mac/Linux)",false,"Inglés, Francés, Alemán, Italiano",No hay soporte para este tipo de idioma,"Inglés, Francés, Alemán, Italiano",true,true,true,3 MAR 2011,false,ARS,0,ARS 13.99,"ARS$ 0,00"
56433,Incluye 4 habilidades únicas y objetos de combate para equipar a tu escuadrón.LOS EJECUTORES DEL EMPERADOR: Eliminan instantáneamente unidades de infantería a las que les queden menos de una quinta parte de su saludCAPARAZÓN BENDITO DE RESOLUCIÓN: Las unidades aliadas que estén en los alrededores aumentan su resistencia a los...,dlc,"Warhammer 40,000: Dawn of War II - Retribution Imperial Guard Race Pack","SEGA, Feral Interactive (Mac/Linux)","Relic Entertainment, Feral Interactive (Mac/Linux)",false,"Inglés, Francés, Alemán, Italiano",No hay soporte para este tipo de idioma,"Inglés, Francés, Alemán, Italiano",true,true,true,3 MAR 2011,false,ARS,0,ARS 39.99,"ARS$ 0,00"
56438,"¡El famoso modo supervivencia de Dawn of War II, The Last Stand, está ahora disponible como juego independiente y dispone de 6 nuevos paquetes Wargear.",game,Dawn of War II: Retribution – The Last Stand,"SEGA, Feral Interactive (Mac/Linux)","Relic Entertainment, Feral Interactive (Mac/Linux)",false,"Inglés, Francés, Alemán, Italiano, Español de España",No hay soporte para este tipo de idioma,"Inglés, Francés, Alemán, Italiano, Español de España",true,true,true,20 ABR 2011,false,ARS,0,ARS 129.99,"ARS$ 129,99"
56434,Incluye 4 habilidades únicas y objetos de combate para equipar a tu escuadrón.HACHA SAGRADA DE LA GUARDIA DE HONOR: Esta especial hacha de energía a dos manos aumenta tu defensa frente a los ataques enemigosARMADURA DEL MÁRTIR: Los ataques contra Diomedes curan a las unidades aliadas que lo rodeanCANTO DEL JUSTO: Los enemigos que atacan...,dlc,"Warhammer 40,000: Dawn of War II - Retribution Space Marines Race Pack","SEGA, Feral Interactive (Mac/Linux)","Relic Entertainment, Feral Interactive (Mac/Linux)",false,"Inglés, Francés, Alemán, Italiano",No hay soporte para este tipo de idioma,"Inglés, Francés, Alemán, Italiano",true,true,true,3 MAR 2011,false,ARS,0,ARS 39.99,"ARS$ 0,00"
56485,Mejora el equipamiento de tus héroes y encuentra nuevas formas de jugar y competir en The Last Stand con estos nuevos objetos de combate.Caparazón espinoso (armadura)No confundir con la espada espinosa. El caparazón espinoso es una resistente pieza de armadura cubierta de cuchillas.,dlc,"Warhammer 40,000: Dawn of War II - Retribution - Hive Tyrant Wargear DLC","SEGA, Feral Interactive (Mac/Linux)","Relic Entertainment, Feral Interactive (Mac/Linux)",false,"Inglés, Francés, Alemán, Italiano",No hay soporte para este tipo de idioma,"Inglés, Francés, Alemán, Italiano",true,true,true,26 MAY 2011,false,ARS,0,ARS 39.99,"ARS$ 0,00"
56481,"Mejora el equipamiento de tus héroes y encuentra nuevas formas de jugar y competir en The Last Stand con estos nuevos objetos de combate.Espada de bruja debilitadora (arma de una mano)La espada de bruja debilitadora pretende ser un arma de tanque, si estás familiarizado con los términos de los MMORPG.",dlc,"Warhammer 40,000: Dawn of War II - Retribution - Farseer Wargear DLC","SEGA, Feral Interactive (Mac/Linux)","Relic Entertainment, Feral Interactive (Mac/Linux)",false,"Inglés, Francés, Alemán, Italiano",No hay soporte para este tipo de idioma,"Inglés, Francés, Alemán, Italiano",true,true,true,26 MAY 2011,false,ARS,0,ARS 39.99,"ARS$ 0,00"
56480,Mejora el equipamiento de tus héroes y encuentra nuevas formas de jugar y competir en The Last Stand con estos nuevos objetos de combate. Escudo de combate con grabado (arma de una mano)El escudo de combate con grabado cuenta como un arma de una mano que ocupa el hueco de una pistola.,dlc,"Warhammer 40,000: Dawn of War II: Retribution - Captain Wargear DLC","SEGA, Feral Interactive (Mac/Linux)","Relic Entertainment, Feral Interactive (Mac/Linux)",false,"Inglés, Francés, Alemán, Italiano",No hay soporte para este tipo de idioma,"Inglés, Francés, Alemán, Italiano",true,true,true,26 MAY 2011,false,ARS,0,ARS 39.99,"ARS$ 0,00"
56489,"El Pack Imperial Guard Death Korps of Krieg Regiment añade el emblemático regimiento de la Guardia Imperial a Warhammer® 40,000®: Dawn of War® II: Retribution™ con diez modelos únicos para las unidades multijugador más importantes así como los colores distintivos de los Korps de la Muerte.",dlc,"Warhammer 40,000: Dawn of War II - Retribution - Death Korps of Krieg Skin Pack","SEGA, Feral Interactive (Mac/Linux)","Relic Entertainment, Feral Interactive (Mac/Linux)",false,"Inglés, Francés, Alemán, Italiano",No hay soporte para este tipo de idioma,"Inglés, Francés, Alemán, Italiano",true,true,true,20 OCT 2011,false,ARS,0,ARS 94.99,"ARS$ 94,99"
56487,"El Pack Ultramarines añade el emblemático capítulo Marine Espacial a Warhammer® 40,000®: Dawn of War® II: Retribution™ con ocho modelos únicos para las principales unidades multijugador, así como nuevas combinaciones de colores para el resto.",dlc,"Warhammer 40,000: Dawn of War II - Ultramarines Pack","SEGA, Feral Interactive (Mac/Linux)","Relic Entertainment, Feral Interactive (Mac/Linux)",false,"Inglés, Francés, Alemán, Italiano",No hay soporte para este tipo de idioma,"Inglés, Francés, Alemán, Italiano",true,true,true,16 AGO 2011,false,ARS,0,ARS 94.99,"ARS$ 94,99"
56488,"El Pack Chaos Word Bearers añade la emblemática Legión de Marines del Espacio del Caos a Warhammer® 40,000®: Dawn of War® II: Retribution™ con siete modelos únicos para las principales unidades multijugador así como nuevos esquemas de colores para las demás.",dlc,"Warhammer 40,000: Dawn of War II: Retribution - Word Bearers Skin Pack","SEGA, Feral Interactive (Mac/Linux)","Relic Entertainment, Feral Interactive (Mac/Linux)",false,"Inglés, Francés, Alemán, Italiano",No hay soporte para este tipo de idioma,"Inglés, Francés, Alemán, Italiano",true,true,true,20 OCT 2011,false,ARS,0,ARS 94.99,"ARS$ 94,99"
56482,Mejora el equipamiento de tus héroes y encuentra nuevas formas de jugar y competir en The Last Stand con estos nuevos objetos de combate.Teletransportador potenciado (accesorio)Este teletransportador orco provoca un poco de destrucción añadida. Otorga un rasgo llamado ¿Porte? ¿Qué Porte?,dlc,"Warhammer 40,000: Dawn of War II - Retribution - Mekboy Wargear DLC","SEGA, Feral Interactive (Mac/Linux)","Relic Entertainment, Feral Interactive (Mac/Linux)",false,"Inglés, Francés, Alemán, Italiano",No hay soporte para este tipo de idioma,"Inglés, Francés, Alemán, Italiano",true,true,true,26 MAY 2011,false,ARS,0,ARS 39.99,"ARS$ 0,00"
56483,"Mejora el equipamiento de tus héroes y encuentra nuevas formas de jugar y competir en The Last Stand con estos nuevos objetos de combate.Trofeo de úrsido (accesorio)Esta capa otorga dos rasgos. El primero es Deseo Inspirado, el cual aumenta la salud de toda la infantería del General.",dlc,"Warhammer 40,000: Dawn of War II - Retribution - Lord General Wargear DLC","SEGA, Feral Interactive (Mac/Linux)","Relic Entertainment, Feral Interactive (Mac/Linux)",false,"Inglés, Francés, Alemán, Italiano",No hay soporte para este tipo de idioma,"Inglés, Francés, Alemán, Italiano",true,true,true,26 MAY 2011,false,ARS,0,ARS 39.99,"ARS$ 0,00"
56484,Mejora el equipamiento de tus héroes y encuentra nuevas formas de jugar y competir en The Last Stand con estos nuevos objetos de combate.Yelmo con epígrafe (accesorio)Este accesorio tiene un rasco único llamado Fortificación Oscura.,dlc,"Warhammer 40,000: Dawn of War II - Retribution - Chaos Sorcerer Wargear DLC","SEGA, Feral Interactive (Mac/Linux)","Relic Entertainment, Feral Interactive (Mac/Linux)",false,"Inglés, Francés, Alemán, Italiano",No hay soporte para este tipo de idioma,"Inglés, Francés, Alemán, Italiano",true,true,true,26 MAY 2011,false,ARS,0,ARS 39.99,"ARS$ 0,00"
57200,Encuentra la solución de más de 100 puzles y disfruta de la satisfacción de los momentos &quot;Ajá&quot;.,game,Puzzle Dimension,Doctor Entertainment AB,Doctor Entertainment AB,false,"Inglés, Francés, Alemán, Italiano, Polaco, Portugués de Portugal, Ruso, Español de España, Sueco, Japonés, Chino simplificado",No hay soporte para este tipo de idioma,"Inglés, Francés, Alemán, Italiano, Polaco, Portugués de Portugal, Ruso, Español de España, Sueco, Japonés, Chino simplificado",true,true,false,21 JUN 2010,false,ARS,0,ARS 249.00,"ARS$ 249,00"
56536,"El Pack Dark Angels añade el emblemático capítulo Space Marine a Warhammer® 40,000®: Dawn of War® II: Retribution™ con ocho modelos únicos para las principales unidades multijugador además de nuevos esquemas de color para el resto.",dlc,"Warhammer 40,000: Dawn of War II: Retribution: Dark Angels Pack","SEGA, Feral Interactive (Mac/Linux)","Relic Entertainment, Feral Interactive (Mac/Linux)",false,"Inglés, Francés, Alemán, Italiano",No hay soporte para este tipo de idioma,"Inglés, Francés, Alemán, Italiano",true,true,true,6 ABR 2011,false,ARS,0,ARS 94.99,"ARS$ 94,99"
56493,"El Comandante Tau es un tipo de héroe totalmente nuevo para Warhammer® 40,000®: Dawn of War® II: Retribution™ y Warhammer® 40,000®: Dawn of War® II: The Last Stand Alone™. El Comandante Tau incluye 26 piezas de equipo de combate, 2 logros, un nuevo doblaje y 20 niveles de progresión.",dlc,"Warhammer 40,000: Dawn of War II - Retribution - The Last Stand Tau Commander","SEGA, Feral Interactive (Mac/Linux)","Relic Entertainment, Feral Interactive (Mac/Linux)",false,"Inglés, Francés, Alemán, Italiano",No hay soporte para este tipo de idioma,"Inglés, Francés, Alemán, Italiano",true,true,true,20 OCT 2011,false,ARS,0,ARS 129.99,"ARS$ 129,99"
57000,"Sobrevuela con Nyx las ruinas de la antigua Grecia en una peligrosa búsqueda para localizar a Icarus, su amigo más querido. Utiliza con sabiduría los poderes de Zeus y los Dioses del Olimpo para ayudar a Nyx a completar esta épica aventuraLanza rayos, da órdenes a los vientos, controla el fuego, enfréntate a la Hidra, navega por las...",game,NyxQuest: Kindred Spirits,Over the Top Games,Over the Top Games,false,"Inglés, Francés, Alemán, Italiano, Español de España",No hay soporte para este tipo de idioma,"Inglés, Francés, Alemán, Italiano, Español de España",true,true,false,27 SEP 2010,false,ARS,0,ARS 39.99,"ARS$ 0,00"
56538,"El pack Ulthwé añade el famoso mundo astronave Eldar a Warhammer® 40,000®: Dawn of War® II: Retribution™ con nueve modelos únicos para las unidades multijugador más importantes, así como nuevas combinaciones de colores para el resto.",dlc,"Warhammer 40,000: Dawn of War II: Retribution - Ulthwe Wargear DLC","SEGA, Feral Interactive (Mac/Linux)","Relic Entertainment, Feral Interactive (Mac/Linux)",false,"Inglés, Francés, Alemán, Italiano",No hay soporte para este tipo de idioma,"Inglés, Francés, Alemán, Italiano",true,true,true,19 JUL 2011,false,ARS,0,ARS 94.99,"ARS$ 94,99"
57300,"Amnesia: The Dark Descent, a first person survival horror. A game about immersion, discovery and living through a nightmare. An experience that will chill you to the core.",game,Amnesia: The Dark Descent,Frictional Games,Frictional Games,false,"Inglés, Francés, Alemán, Italiano, Español de España, Ruso, Chino simplificado",Inglés,"Inglés, Francés, Alemán, Italiano, Español de España, Ruso, Chino simplificado",true,true,true,8 SEP 2010,false,ARS,0,ARS 1400.00,"ARS$ 1.400,00"
57655,"El primer contenido descargable para el aclamado y perverso juego Dungeons ofrece nuevos desafíos para los aspirantes a señor de la mazmorra. Dentro de la campaña de Into the Dark, se incluye el nuevo mapa Flowerdale, donde los jugadores tendrán que enfrentarse a nuevas oleadas de héroes.",dlc,Dungeons - Into the Dark,Kalypso Media Digital,Realmforge Studios,false,"Inglés, Francés, Alemán",No hay soporte para este tipo de idioma,"Inglés, Francés, Alemán",true,false,false,11 ABR 2011,false,ARS,0,ARS 199.00,"ARS$ 199,00"
57640,"La aventura ''Broken Sword: The Director's Cut'', un clásico de todos los tiempos con nominaciones a varios premios BAFTA, sumerge a la atrevida periodista Nico Collard y al intrépido norteamericano George Stobbart en un viaje misterioso lleno de intriga y peligro.",game,Broken Sword: Director's Cut,Revolution Software Ltd,Revolution Software Ltd,false,"Inglés, Francés, Alemán, Español de España, Italiano<strong>*</strong>","Inglés, Francés, Alemán, Español de España","Inglés, Francés, Alemán, Español de España, Italiano<strong>*</strong>",true,true,true,2 SEP 2010,false,ARS,0,ARS 78.99,"ARS$ 78,99"
57620,¡Expansión Rise of a Dynasty ya disponible!,game,Patrician IV,Kalypso Media Digital,Gaming Minds Studios,false,"Inglés, Alemán",No hay soporte para este tipo de idioma,"Inglés, Alemán",true,false,false,17 SEP 2010,false,ARS,0,ARS 999.00,"ARS$ 999,00"
57600,"Tropico 3: Absolute Power es la primera expansión oficial del juego aclamado por la crítica Tropico 3 que te ofrece nuevas opciones como soberano de una pequeña nación isleña en el Caribe. Añade una nueva campaña, nuevas misiones, nuevos tipos de isla, edificios únicos y nuevos poderes para maximizar la longevidad y el éxito de tu...",dlc,Tropico 3: Absolute Power,Kalypso Media Digital,Haemimont Games,false,"Inglés, Francés, Alemán, Italiano, Español de España",No hay soporte para este tipo de idioma,"Inglés, Francés, Alemán, Italiano, Español de España",true,false,false,17 MAY 2010,false,ARS,0,ARS 649.00,"ARS$ 649,00"
57650,¡Nuevo DLC ya disponible!,game,Dungeons,Kalypso Media Digital,Realmforge Studios,false,"Inglés, Alemán, Francés, Polaco",No hay soporte para este tipo de idioma,"Inglés, Alemán, Francés, Polaco",true,false,false,10 FEB 2011,false,ARS,0,ARS 649.00,"ARS$ 649,00"
57697,"Nueva misión, características y elementos para Tropico 4.",dlc,Tropico 4: Quick-dry Cement DLC,Kalypso Media Digital,Haemimont Games,false,"Inglés, Francés, Alemán",No hay soporte para este tipo de idioma,"Inglés, Francés, Alemán",true,false,false,7 FEB 2012,false,ARS,50,ARS 149.00,"ARS$ 74,50"
57730,"Patrician IV - Rise of a Dynasty trae un exhaustivo paquete de mejoras y nuevas características para el exitoso Patrician IV, incluyendo un modo multijugador online y nuevos escenarios.Finalmente serás capaz de manejar tu negocio con la ayuda de hasta tres amigos a través del modo cooperativo online.",dlc,Patrician IV: Rise of a Dynasty,Kalypso Media Digital,Gaming Minds Studios,false,"Inglés, Francés, Alemán",No hay soporte para este tipo de idioma,"Inglés, Francés, Alemán",true,false,false,11 ABR 2011,false,ARS,0,ARS 649.00,"ARS$ 649,00"
57696,"¡Hora de ponerse militar! Afianza el control de Trópico con el nuevo búnker y el rasgo de personaje &quot;Veterano&quot; para conseguir un líder militar más avezado en la batalla y un apropiado uniforme de gala. Decora la isla con las nuevas cabinas de guardia, torre de observación, depósito de munición, barricadas ¡y un tanque!",dlc,Tropico 4: Junta Military DLC,Kalypso Media Digital,Haemimont Games,false,"Inglés, Francés, Alemán",No hay soporte para este tipo de idioma,"Inglés, Francés, Alemán",true,false,false,3 NOV 2011,false,ARS,50,ARS 149.00,"ARS$ 74,50"
57690,"El mundo está cambiando y Tropico avanza con el tiempo. Los poderes geográficos se alzan y caen, el mercado global está dominado por nuevos jugadores con nuevas demandas y ofertas y tú, como El Presidente, te enfrentas a nueva serie de desafíos.",game,Tropico 4,Kalypso Media Digital,Haemimont Games,false,"Inglés, Francés, Alemán, Italiano, Español de España, Coreano","Inglés, Francés, Alemán, Italiano, Español de España","Inglés, Francés, Alemán, Italiano, Español de España, Coreano",true,false,false,1 SEP 2011,false,ARS,50,ARS 999.00,"ARS$ 499,50"
57680,¡Descubre los secretos que hay tras la Orden del Temple! La edición exclusiva para Steam incluye la misión adicional “La Arena”.,game,The First Templar - Steam Special Edition,Kalypso Media Digital,Haemimont Games,false,"Inglés, Francés, Alemán",No hay soporte para este tipo de idioma,"Inglés, Francés, Alemán",true,false,false,12 MAY 2011,false,ARS,0,ARS 649.00,"ARS$ 649,00"
57695,¡Entra en el negocio de las plantaciones!,dlc,Tropico 4: Plantador DLC,Kalypso Media Digital,Haemimont Games,false,"Inglés, Francés, Alemán",Inglés,"Inglés, Francés, Alemán",true,false,false,14 DIC 2011,false,ARS,50,ARS 149.00,"ARS$ 74,50"
57656,El segundo contenido descargable para el aclamado y perverso juego Dungeons trae consigo 50 mapas y 5 fondos de pantalla nuevos.,dlc,Dungeons - Map Pack,Kalypso Media Digital,Realmforge Studios,false,"Inglés, Francés, Alemán",No hay soporte para este tipo de idioma,"Inglés, Francés, Alemán",true,false,false,1 JUL 2011,false,ARS,0,ARS 149.00,"ARS$ 149,00"
57700,"Como el misterioso y poderoso &quot;Guardián de la Tierra&quot;, tu acerado ojo y tu HIPERPODEROSO BRAZO LÁSER han mantenido a los ciudadanos de la Tierra a salvo durante generaciones.",game,Who's That Flying?!,Kalypso Media Digital,Mediatonic,false,Inglés,No hay soporte para este tipo de idioma,Inglés,true,false,false,31 ENE 2011,false,ARS,0,ARS 399.99,"ARS$ 399,99"
57923,"El primer contenido adicional para Duke Nukem Forever, Hail to the Icons Parody Pack, contiene 3 nuevos modos de juego y 4 nuevos mapas multijugador, cada uno con nuevas armas.Características principales:Tres Nuevos Modos – Freeze Tag proporciona parte de lo más divertido del juego por equipos en Duke Nukem Forever.",dlc,Duke Nukem Forever: Hail to the Icons Parody Pack,2K,Gearbox Software,false,"Inglés, Francés, Alemán, Italiano, Español de España",No hay soporte para este tipo de idioma,"Inglés, Francés, Alemán, Italiano, Español de España",true,true,false,11 OCT 2011,false,ARS,0,ARS 179.99,"ARS$ 179,99"
