SteamAppid,Description,Type,Name,Publishers,Developers,isFree,InterfaceLanguages,FullAudioLanguages,SubtitlesLanguages,Windows,Mac,Linux,Date,ComingSoon,Currency,DiscountPercent,InitialFormatted,FinalFormatted
24400,"Bienvenido a la desaparecida era de la caballería, donde magia y mito están a la orden del día, y tu destino es convertirte en una leyenda viva: Arturo, el hijo de Uther Pendragon, el Único y Futuro Rey de las profecías. Cumple con tu destino y reclama tu derecho al trono de Britania.",game,King Arthur - The Role-playing Wargame,Paradox Interactive,NeocoreGames,false,Inglés,No hay soporte para este tipo de idioma,Inglés,true,false,false,24 NOV 2009,false,ARS,0,ARS 129.99,"ARS$ 129,99"
24420,"Aquaria es un premiado juego de aventuras ambientado en un enorme mundo subacuático repleto de vida y secretos ancestrales. Únete a Naija, una solitaria aventurera submarina, en su viaje desde cavernas ocultas en penumbra hasta hermosos oasis iluminados por la luz del sol, en el afán de descubrir su pasado.",game,Aquaria,"Bit Blot, LLC","Bit Blot, LLC",false,Inglés,No hay soporte para este tipo de idioma,Inglés,true,false,true,15 DIC 2008,false,ARS,0,ARS 129.99,"ARS$ 129,99"
24488,"This is a tale of revival, resurrection and revenge; the chronicle of how the greatest adversary of King Arthur came into power – and the terrible price he had to pay. Our journey begins in Eboracum, in one of the greatest cities built in the Roman provinces of Britannia.",dlc,King Arthur II: Dead Legions,Paradox Interactive,NEOCORE GAMES,false,Inglés,No hay soporte para este tipo de idioma,Inglés,true,false,false,27 ENE 2012,false,ARS,0,ARS 67.99,"ARS$ 67,99"
24480,¡Experimenta la secuela del exitoso juego de rol y estrategia en tiempo real!,game,King Arthur II: The Role-Playing Wargame,Paradox Interactive,NeocoreGames,false,Inglés,No hay soporte para este tipo de idioma,Inglés,true,false,false,27 ENE 2012,false,ARS,0,ARS 129.99,"ARS$ 129,99"
24449,"Gales es un hermoso y feroz reino independiente de señores tribales, brujos y dragones que dormitan bajo las raíces de Snowdonia. Su nuevo líder, el Rey Ryons, era uno de los caudillos más peligrosos de la tierra. Ahora quiere volver a instaurar el poder de la Antigua Fe en Britannia y él siempre logra lo que se propone.",dlc,King Arthur: The Druids,Paradox Interactive,NeoCoreGames,false,Inglés,No hay soporte para este tipo de idioma,Inglés,true,false,false,3 FEB 2011,false,ARS,0,ARS 53.99,"ARS$ 53,99"
24460,¡Una expansión independiente totalmente nueva para el exitoso juego de rol y estrategia!,game,King Arthur: Fallen Champions,Paradox Interactive,NeocoreGames,false,"Inglés, Francés, Alemán, Español de España",No hay soporte para este tipo de idioma,"Inglés, Francés, Alemán, Español de España",true,false,false,16 SEP 2011,false,ARS,0,ARS 67.99,"ARS$ 67,99"
24635,"El conjunto Duchess, con multitud de características, es imprescindible para cualquiera con un gusto por el romanticismo de los ferrocarriles. Concebida por la oficina de Sir William A. Stanier, FRS, la Duchess es un clásico ejemplo de la ingeniería británica en su máxima expresión.",dlc,Trainz Simulator DLC: The Duchess,N3V Games,N3V Games,false,Inglés,No hay soporte para este tipo de idioma,Inglés,true,false,false,22 JUN 2011,false,ARS,0,ARS 199.99,"ARS$ 199,99"
24634,"El pack Blue Comet recrea la excitación y el esplendor de este excepcional tren. Con un increíble nivel de detalle y haciendo uso de efectos de humo, sonido y física de última generación, Blue Comet promete ser un añadido más que satisfactorio para tu colección de Trainz.",dlc,Trainz Simulator DLC: Blue Comet,N3V Games,N3V Games,false,Inglés,No hay soporte para este tipo de idioma,Inglés,true,false,false,6 AGO 2010,false,ARS,0,ARS 199.99,"ARS$ 199,99"
24676,The PRR T1 'A Fleet of Modernism' DLC Pack recreates the striking image of these shark nosed behemoths in their days of speeding the 'Fleet of Modernism' cars to their destination on trains such as 'The Broadway Limited' and 'The General'.,dlc,Trainz Simulator DLC: PRR T1,N3V Games,N3V Games,false,Inglés,No hay soporte para este tipo de idioma,Inglés,true,false,false,29 NOV 2012,false,ARS,0,ARS 199.99,"ARS$ 199,99"
24678,"British Rail devised the Class 14 locomotives to replace the seemingly indispensable ex-GWR Pannier Tanks which busily performed shunting duties, yard transfers and short haul freight services on Western Region tracks.",dlc,Trainz Simulator DLC: BR Class 14,N3V Games,N3V Games,false,Inglés<strong>*</strong>,No hay soporte para este tipo de idioma,Inglés<strong>*</strong>,true,false,false,6 MAY 2013,false,ARS,0,ARS 199.99,"ARS$ 199,99"
24673,"By the 1950's, passenger revenues on America's railroads had long since passed their heyday. Automobiles were fast becoming an affordable option for the modern traveller, and flight was also steadily gaining in popularity.",dlc,Trainz Simulator DLC: Aerotrain,N3V Games,N3V Games,false,Inglés<strong>*</strong>,No hay soporte para este tipo de idioma,Inglés<strong>*</strong>,true,false,false,,false,,0,ARS 0.00,
24640,Classic Cabon City es una gran ciudad con más de 180 estaciones y un sistema de doble vía que te permite elegir libremente la ruta a tu destino. Conduce dos tranvías distintos desde sus propias cabinas y sigue tu ruta en el interfaz HUD.,game,Trainz: Classic Cabon City,N3V Games,N3V Games,false,Inglés,No hay soporte para este tipo de idioma,Inglés,true,false,false,1 SEP 2010,false,ARS,0,ARS 224.99,"ARS$ 224,99"
24650,"Te traemos la que fue una de las líneas principales más famosas y escénicas de Gran Bretaña en el momento de la transición del vapor al diésel. Con 10 tipos diferentes de locomotoras y docenas de vagones a tu disposición, tú decides qué tren conducir.",game,Trainz Settle and Carlisle,N3V Games,N3V Games,false,Inglés,No hay soporte para este tipo de idioma,Inglés,true,false,false,1 OCT 2010,false,ARS,0,ARS 224.99,"ARS$ 224,99"
24660,"Murchison 2 es una mezcla de la red maderera de vía estrecha Murchison original con una amplia red ferroviaria de vía de ancho estándar.Mediante la incorporación de paisajes basados en mapas electrónicos reales de Nueva Zelanda junto con unos Conjuntos de Naturaleza creados especialmente (cascadas animadas, líneas fluviales, texturas,...",game,Trainz: Murchison 2,N3V Games,N3V Games,false,Inglés,No hay soporte para este tipo de idioma,Inglés,true,false,false,,false,,0,ARS 0.00,
24677,"The Coronation Scot is a powerful steam passenger locomotive built for British railways in the 1930’s. The Coronation Scot celebrates the halcyon days of LMS passenger service by recreating the sights and sounds of this historic train, and is now available as part of your Trainz collection.",dlc,Trainz Simulator DLC: Coronation Scot,N3V Games,N3V Games,false,Inglés<strong>*</strong>,No hay soporte para este tipo de idioma,Inglés<strong>*</strong>,true,false,false,6 MAY 2013,false,ARS,0,ARS 199.99,"ARS$ 199,99"
24670,Released 2011. See also Trainz A New Era and TRS19.,game,Trainz™ Simulator 12,N3V Games,N3V Games,false,Inglés<strong>*</strong>,No hay soporte para este tipo de idioma,Inglés<strong>*</strong>,true,false,false,8 JUN 2011,false,ARS,0,ARS 129.99,"ARS$ 129,99"
24800,"Red Alert 3: Uprising cuenta con cuatro minicampañas nuevas, permitiendo que los jugadores se adentren más en la historia de los soviéticos, los Aliados y el Imperio del Sol Naciente, e incluye una única campaña centrada en los orígenes del comando de colegialas japonesas preferido por todos: Yuriko Omega.",game,Command & Conquer: Red Alert 3 - Uprising,Electronic Arts,EA Los Angeles,false,"Inglés, Checo, Francés, Alemán, Húngaro, Italiano, Polaco, Ruso, Español de España",No hay soporte para este tipo de idioma,"Inglés, Checo, Francés, Alemán, Húngaro, Italiano, Polaco, Ruso, Español de España",true,false,false,6 OCT 2009,false,ARS,0,ARS 899.00,"ARS$ 899,00"
24780,"Consigue SimCity 4 y SimCity™ 4 Rush Hour en este práctico pack. Crea, haz crecer, y llena de vida tu entorno urbano ideal. Enfréntate a desastres tanto reales como fantásticos. Gobierna tu propia metrópolis virtual con SimCity 4.En SimCity 4 no te limitas a construir tu ciudad, sino que además le das vida.",game,SimCity™ 4 Deluxe Edition,"Electronic Arts, Aspyr (Mac)","EA - Maxis, Aspyr (Mac)",false,"Danés, Holandés, Inglés, Francés, Alemán, Italiano, Español de España, Sueco",No hay soporte para este tipo de idioma,"Danés, Holandés, Inglés, Francés, Alemán, Italiano, Español de España, Sueco",true,true,false,20 JUL 2010,false,ARS,0,ARS 899.00,"ARS$ 899,00"
24790,Es el año 2047. Una enorme bola de fuego estalla en el cielo nocturno señalando el dramático comienzo de la Tercera Guerra del Tiberio y el esperado regreso de la saga de estrategia en tiempo real más innovadora de todos los tiempos.,game,Command & Conquer 3: Tiberium Wars,Electronic Arts,EA Los Angeles,false,"Holandés, Inglés, Francés, Alemán, Italiano, Polaco, Ruso, Español de España, Sueco",No hay soporte para este tipo de idioma,"Holandés, Inglés, Francés, Alemán, Italiano, Polaco, Ruso, Español de España, Sueco",true,false,false,13 NOV 2009,false,ARS,0,ARS 699.00,"ARS$ 699,00"
24810,"¡En el nombre de Kane! La saga Command &amp; Conquer™ sigue creciendo con Command &amp; Conquer™ 3: Kane’s Wrath. Como pack de expansión del aclamado y favorito Command &amp; Conquer 3 Tiberium Wars™, este juego de estrategia en tiempo real (RTS) regresa al Universo del Tiberio con Kane en el centro de una nueva y épica campaña para un...",game,Command & Conquer 3: Kane's Wrath,Electronic Arts,EA Los Angeles,false,"Holandés, Inglés, Francés, Alemán, Italiano, Polaco, Ruso, Español de España, Sueco",No hay soporte para este tipo de idioma,"Holandés, Inglés, Francés, Alemán, Italiano, Polaco, Ruso, Español de España, Sueco",true,false,false,13 NOV 2009,false,ARS,0,ARS 699.00,"ARS$ 699,00"
24720,"Lleva a tu Criatura desde Cero hasta Héroe GalácticoSal de tu nave estelar y convierte a tus criaturas de Spore en legendarios Capitanes Espaciales. Por primera vez, forja alianzas y embárcate en aventuras cargadas de acción planetaria. Completa misiones, recoge recompensas e incluso crea tus propias misiones.",game,SPORE™ Galactic Adventures,Electronic Arts,EA - Maxis,false,"Inglés, Francés, Alemán, Italiano, Español de España, Holandés, Ruso, Polaco, Checo, Húngaro, Finés, Noruego, Sueco, Danés",No hay soporte para este tipo de idioma,"Inglés, Francés, Alemán, Italiano, Español de España, Holandés, Ruso, Polaco, Checo, Húngaro, Finés, Noruego, Sueco, Danés",true,false,false,26 JUN 2009,false,ARS,0,ARS 899.00,"ARS$ 899,00"
24679,The Shao Shan 4 (SS4 improved) electric locomotive is one of the most powerful DC electric locomotives in China. Manufacturing began in the mid 1980's and the locomotives are widely used throughout most of China's electrified railways to this day.,dlc,Trainz Simulator DLC: SS4 China Coal Heavy Haul Pack,N3V Games,N3V Games,false,Inglés<strong>*</strong>,No hay soporte para este tipo de idioma,Inglés<strong>*</strong>,true,false,false,4 DIC 2013,false,ARS,0,ARS 169.99,"ARS$ 169,99"
24870,"El premiado Need for Speed™ SHIFT es un auténtico juego de carreras que combina la experiencia real del conductor con una física realista, modelos de coches totalmente perfectos y una amplia variedad de pistas de carreras auténticas.",game,Need for Speed: Shift,Electronic Arts,Slightly Mad Studios,false,"Inglés, Francés, Alemán, Español de España, Italiano, Polaco, Ruso",No hay soporte para este tipo de idioma,"Inglés, Francés, Alemán, Español de España, Italiano, Polaco, Ruso",true,false,false,6 OCT 2009,false,,0,ARS 0.00,
25010,"Sigue a Turner, un conejo rebelde con unas impresionantes habilidades para el combate, en su búsqueda para localizar a los responsables de la matanza en su poblado. Descubre una conspiración a gran escala que envuelve a los corruptos líderes de la república de los conejos y a los lobos de las tierras cercanas.",game,Lugaru HD,Wolfire Games,Wolfire Games,false,Inglés,No hay soporte para este tipo de idioma,Inglés,true,true,true,8 OCT 2010,false,ARS,0,ARS 765.00,"ARS$ 765,00"
25000,"Feel like the star of a martial arts film in Overgrowth, as you jump, kick, throw, and slash your way to victory. Free the rabbits from their evil overlords in the main story, then play through the prequel story, and finally, try out nine years of mods developed by the community, or create your own!",game,Overgrowth,Wolfire Games,Wolfire Games,false,Inglés,No hay soporte para este tipo de idioma,Inglés,true,true,true,16 OCT 2017,false,ARS,0,ARS 1400.00,"ARS$ 1.400,00"
25500,"Cricket Revolution es un juego multijugador de cricket para PC. Con una mecánica de juego novedosa, modos de juego multijugador y un solo jugador, campeonatos locales y globales, y desafiantes oponentes controlados por un IA que aprende de cada una de tus jugadas, ¡Cricket Revolution proporciona una experiencia lúdica como ninguna otra!",game,Cricket Revolution,Mindstorm Studios,Mindstorm Studios,false,Inglés,No hay soporte para este tipo de idioma,Inglés,true,false,false,28 OCT 2009,false,,0,ARS 0.00,
37240,"En una visita a su ciudad natal, Flo y su Abuela Florence rememoran viejos tiempos. Lleva de nuevo a la vida a cinco restaurantes y conoce a nuevos clientes como el Hombre Hambriento y el Famoso. Ten especial cuidado con los clientes que tengan reservas y pon flores en las mesas para alegrar aún más las comidas.",game,Diner Dash:® Hometown Hero™,PlayFirst,PlayFirst,false,Inglés,No hay soporte para este tipo de idioma,Inglés,true,true,false,12 AGO 2009,false,,0,ARS 0.00,
37280,"Quinn ha regresado en una nueva y arrolladora aventura, junto con Flo&reg; y Joe Wright, el fotógrafo de bodas. Ayuda a Quinn a convertirse en el mejor organizador de bodas del mundo en la delirante secuela del éxito Wedding Dash&reg;.",game,Wedding Dash® 2: Rings Around the World,PlayFirst,Sarbakan,false,Inglés,No hay soporte para este tipo de idioma,Inglés,true,true,false,12 AGO 2009,false,,0,ARS 0.00,
37230,"¡Ha sido niña! ¡Y niño! De hecho, han sido todos los adorables bebés en DinerTown, todos ellos están preparados para recibir tus mimitos. Cuida a estos adorables angelitos de DinerTown y ayuda a Wilson, el pobre está desbordado atendiendo a su guardería.",game,Diaper Dash®,PlayFirst,Zemnott,false,Inglés,No hay soporte para este tipo de idioma,Inglés,true,true,false,12 AGO 2009,false,,0,ARS 0.00,
37000,"Only brought to life by scarce sparks of Color, the bleak, grey Void is a peculiar place. The player gets to explore it, get to know the Sisters, Brothers, and other weird creatures inhabiting it, and learn the ways of Color, harvesting it and drawing sigils that change the world around them.",game,The Void,Ice-Pick Lodge,Ice-Pick Lodge,false,"Inglés, Alemán, Polaco, Ruso<strong>*</strong>","Inglés, Alemán, Polaco","Inglés, Alemán, Polaco, Ruso<strong>*</strong>",true,false,false,15 DIC 2009,false,ARS,0,ARS 129.99,"ARS$ 129,99"
37210,"Viaja por todo el mundo en busca de ingredientes exóticos y sabrosos para personalizar tus propias creaciones de chocolate. ¡Podrás usar avances económicos y tecnológicos posteriores a la IIGM para personalizar tus propias creaciones de chocolate, ayudar a los Baumeister y esforzarte por llegar a ser el mandamás de tu propio imperio del...",game,Chocolatier®: Decadence by Design™,PlayFirst,"Big Splash Games, LLC",false,Inglés,No hay soporte para este tipo de idioma,Inglés,true,true,false,12 AGO 2009,false,,0,ARS 0.00,
37220,"Cuando Cookie el Chef abandona Flo's Diner para buscar una oportunidad en un conocido reality de TV sobre cocina, Cookie invita a todos los chef de DinerTown a salir en el programa cómo estrellas invitadas. Flo, con su abuela, ayuda a los cuatro restaurantes de DinerTown y ¡acaba en un set de Flo's Diner con Cookie en Hollywood!",game,Cooking Dash®,PlayFirst,Aliasworlds Entertainment,false,Inglés,No hay soporte para este tipo de idioma,Inglés,true,true,false,12 AGO 2009,false,,0,ARS 0.00,
37260,"¡Trabaja con la detective más astuta del mundo en el oscuro corazón de Emerald City de Oz! Como Petra, serás llevada a lo más profundo de los misterios que envolverán a nuevos enemigos y a caras conocidas; Scarecrow, Lion y Toto incluídos. ¡Esto es Oz como nunca antes lo habías visto!",game,Emerald City Confidential™,PlayFirst,Wadjet Eye Games,false,Inglés,No hay soporte para este tipo de idioma,Inglés,true,false,false,12 AGO 2009,false,,0,ARS 0.00,
37270,"¿Listo para una nueva aventura? Bienvenido a Wandering Willows&trade;, un maravilloso mundo lleno de una increíble vida salvaje y atractivas misiones. Con más de cuarenta encantadoras mascotas para tenerlas como amigas y entrenarlas, tienes la certeza de contar con la mejor ayuda a la hora de completar las misiones para los divertidos...",game,Wandering Willows™,PlayFirst,PlayFirst,false,Inglés,No hay soporte para este tipo de idioma,Inglés,true,true,false,12 AGO 2009,false,,0,ARS 0.00,
37330,"Nightshift Legacy te transporta a una aventura histórica repleta de romance e intriga con los héroes de Nightshift Code, Mike e Isabel. Deberás viajar desde las junglas de Guatemala hasta las calles de Moscú, desde el presente hasta el pasado durante la Guerra Civil Española, codo con codo junto a figuras históricas como Frida Kahlo y...",game,Nightshift Legacy: The Jaguar's Eye™,PlayFirst,PlayFirst,false,Inglés,No hay soporte para este tipo de idioma,Inglés,true,true,false,6 MAY 2010,false,,0,ARS 0.00,
37300,"La malvada cadena de comida rápida Grub Burger ha logrado colarse en DinerTown™ a base de sobornos y ahora amenaza con mandar a la quiebra a las cafeterías locales mediante precios muy bajos, sospechosas tácticas ¡y el misterioso Ingrediente X!",game,DinerTown Tycoon,PlayFirst,PlayFirst,false,Inglés,No hay soporte para este tipo de idioma,Inglés,true,true,false,30 SEP 2009,false,,0,ARS 0.00,
37380,"¡Asesinato, escándalo y tu primera gran oportunidad! Eres una joven aspirante a reportera, hambrienta por lograr tu primera exclusiva en el mundo del periodismo de 1920 dominado por los hombres. No estás dispuesta a conformarte con tu papel de secretaria, y pronto te encontrarás con un asesinato de primera plana, un escandaloso...",game,Valerie Porter and the Scarlet Scandal™,PlayFirst,PlayFirst,false,Inglés,No hay soporte para este tipo de idioma,Inglés,true,true,false,6 MAY 2010,false,,0,ARS 0.00,
37290,"¿Te sientes abrumado por tu trabajo? ¿Realizas obedientemente tus quehaceres diarios pero te sientes estresado por el esfuerzo sistemático de tu rutina? Entra en el mundo de Zenerchi, un nuevo juego que da un tranquilo giro al clásico tres en raya.",game,Zenerchi®,PlayFirst,Red Rocket Games,false,Inglés,No hay soporte para este tipo de idioma,Inglés,true,true,false,12 AGO 2009,false,,0,ARS 0.00,
37370,Bienvenido al mundo de TriJinx – ¡un puzle de acción con un inesperado giro! ¡Nos encontramos en Egipto en el año 1935 y estás atrapada en la tumba de Triclops! ¿Puedes superar esta trampa triangular? Conecta triángulos y despeja los colores para ayudar a Kristine Kross a encontrar a su padre desaparecido y a escapar con él.,game,TriJinx: A Kristine Kross Mystery™,PlayFirst,PlayFirst,false,Inglés,No hay soporte para este tipo de idioma,Inglés,true,true,false,6 MAY 2010,false,,0,ARS 0.00,
37320,The Nightshift Code es una aventura de objetos ocultos que conduce a los jugadores a misteriosos y en ocasiones peligrosos viajes desde el Museo de Historia Antigua de Chicago hasta lugares secretos en las Islas Griegas.,game,The Nightshift Code™,PlayFirst,PlayFirst,false,Inglés,No hay soporte para este tipo de idioma,Inglés,true,true,false,6 MAY 2010,false,,0,ARS 0.00,
37310,"¡Algo no cuadra en DinerTown&trade;! Ayuda a Bernie el Ratón de Biblioteca a convertirse en un ""detective de verdad"" buscando pistas vitales sobre importantes misterios como ""¿quién ha clavado su dedo en todos los donuts de gelatina?"" y ""¿quién ha estado de fiesta como un loco con los animales del zoo?",game,DinerTown Detective Agency™,PlayFirst,Absolutist Ltd.,false,Inglés,No hay soporte para este tipo de idioma,Inglés,true,true,false,6 MAY 2010,false,,0,ARS 0.00,
37340,"Mientras practica el jogging, Jo observa cómo sus conciudadanos de DinerTown&reg; engullen hamburguesas dobles de bacon en Flo's Diner unos pocos días antes de la competición anual de tiro de cuerda. Horrorizada, les ruega que dejen de comer cuanto antes dado el riesgo de perder con los Meatropolis Mashers, pero, ay, ignoran sus...",game,Fitness Dash™,PlayFirst,Sarbakan,false,Inglés,No hay soporte para este tipo de idioma,Inglés,true,true,false,6 MAY 2010,false,,0,ARS 0.00,
37360,"En Mahjong Roadshow, deberás de abrirte camino desde los mercadillos de jardín hasta el edificio de subastas para buscar antigüedades de valor incalculable! ¡No dejes ninguna ficha boca abajo mientras escudriñas habitaciones repletas de útiles del día a día hasta que encuentres los objetos más valiosos del planeta!",game,Mahjong Roadshow™,PlayFirst,PlayFirst,false,Inglés,No hay soporte para este tipo de idioma,Inglés,true,true,false,6 MAY 2010,false,,0,ARS 0.00,
37390,"Mientras paseas de regreso a casa con un grupo de amigos, descubres un misterioso haz de luz que procede de un inesperado eclipse solar. ¡La luz te conduce a un antiguo lugar astrológico que de repente os transporta a todos a un extraño mundo!",game,Gemini Lost™,PlayFirst,PlayFirst,false,Inglés,No hay soporte para este tipo de idioma,Inglés,true,true,false,6 MAY 2010,false,,0,ARS 0.00,
37800,"Descubre una nueva dimensión de la diversión en el puzle de acción QuantZ para PC; una aventura fabulosa que va más allá de los géneros Puzle de Acción, Conecta 3 y Destruir Bolas. La mecánica de juego es simple aunque adictiva: tienes el poder de controlar un cubo con tu ratón y lanzar sobre su superficie.",game,Quantz,Gamerizon,Gamerizon,false,"Inglés, Francés, Alemán, Italiano, Japonés, Ruso, Español de España",No hay soporte para este tipo de idioma,"Inglés, Francés, Alemán, Italiano, Japonés, Ruso, Español de España",true,true,false,3 SEP 2009,false,ARS,0,ARS 129.99,"ARS$ 129,99"
37500,"¡En Magnetis™ todo depende de la atracción! Conecta los imanes para crear explosiones eléctricas. ¡La resolución de este frenético puzle necesitará decisiones rápidas y anticipación, preparando las conexiones por adelantado para generar masivas reacciones en cadena que te proporcionen la mayor cantidad de puntos!",game,Magnetis ,Yullaby,Yullaby,false,"Inglés, Francés, Alemán, Italiano, Español de España",No hay soporte para este tipo de idioma,"Inglés, Francés, Alemán, Italiano, Español de España",true,false,false,5 NOV 2009,false,,0,ARS 0.00,
37400,"Ben There, Dan That! y Time Gentlemen, Please! son un par de aventuras animadas estilo 'apunta y pulsa'. Prepárate para reírte con ganas, siéntate, relájate y ponte a resolver puzles mientras disfrutas de unos diálogos realmente divertidos. ¡Es como un libro, pero mejor!",game,"Time Gentlemen, Please! and Ben There, Dan That! Special Edition  Double Pack",Size Five Games,Size Five Games,false,Inglés,No hay soporte para este tipo de idioma,Inglés,true,false,false,25 AGO 2009,false,ARS,0,ARS 67.99,"ARS$ 67,99"
37600,"A short, surprising, toy-like puzzle game.",game,Windosill,Vectorpark,Vectorpark,false,Inglés,No hay soporte para este tipo de idioma,Inglés,true,true,false,25 SEP 2009,false,ARS,0,ARS 249.00,"ARS$ 249,00"
37960,"¡Incluye los tres primeros títulos de la aventura definitiva de conexión de joyas, Jewel Quest! Rupert y Emma han sentado la cabeza y han abierto un museo para mostrar sus muchos artefactos. Mientras jugaba con un misterioso tablero de joyas, su hija abre sin pretenderlo un compartimento secreto.",game,Jewel Quest Pack,iWin,iWin,false,Inglés,No hay soporte para este tipo de idioma,Inglés,true,false,false,24 AGO 2009,false,ARS,0,ARS 224.99,"ARS$ 224,99"
38000,"¡Incluye las tres primeras entregas de Mahjong Quest, el cuento épico de emparejar fichas! ¿Qué significa felicidad? Tú eres Kwazi. Desde tus orígenes tras un misterioso nacimiento en un monasterio ubicado en la cima de una montaña hasta tu arrugada vejez, deberás utilizar las antiguas fichas de Mah Jong de tu abuelo para resolver una...",game,Mahjong Quest Collection,iWin,iWin,false,Inglés,No hay soporte para este tipo de idioma,Inglés,true,false,false,24 AGO 2009,false,ARS,0,ARS 129.99,"ARS$ 129,99"
38080,"¡Dispara el mercado inmobiliario construyendo, comprando y vendiendo casas en el nuevo juego de estrategia Build-a-lot! Puedes renovar casas para conseguir dinero rápido o sentarte y observar cómo tus ingresos por alquiler crecen sin parar.",game,Build-A-Lot,iWin,Hip Soft,false,Inglés,No hay soporte para este tipo de idioma,Inglés,true,false,false,17 DIC 2009,false,ARS,0,ARS 129.99,"ARS$ 129,99"
38070,"En Coconut Queen, la isla de Lui Lui te invita a disfrutar de los kilómetros de su costa bañada por el sol. Desembarca en su embriagador aroma a flores, y descubre que tú eres la Reina de los Cocos que la isla anhela.",game,Coconut Queen,iWin,iWin,false,Inglés,No hay soporte para este tipo de idioma,Inglés,true,false,false,17 DIC 2009,false,ARS,0,ARS 129.99,"ARS$ 129,99"
